{
  "schema_version": "2.0",
  "id": "c40-transforming-cities-jakarta",
  "url": "https://www.c40.org/case-studies/transforming-cities-jakarta/",
  "title": "Transforming Cities: The paint cooling Jakarta",
  "summary": "This C40 case study describes “Transforming Cities: The paint cooling Jakarta,” an urban initiative documented for Jakarta. It is included because it is located in the Global South. C40 describes the action this way: Jakarta is home to over 10 million people who seek shelter indoors from the blistering urban heat. One brilliant architecture professor is…",
  "location_scope": "non_administrative",
  "locations": [
    {
      "level": "non_administrative",
      "place_name": "Jakarta",
      "adm0": {
        "name": "Indonesia",
        "ucode": "IDN_V1",
        "dcid": null,
        "iso3": "IDN"
      },
      "adm1": {
        "name": "Dki Jakarta",
        "ucode": "IDN_0011_V1",
        "dcid": null
      },
      "adm2": null
    }
  ],
  "hazards": [],
  "data_sources": [],
  "provenance": {
    "collection_name": "C40 Cities case studies",
    "collection_url": "https://www.c40.org/case-studies/",
    "publisher": "C40 Cities",
    "document_url": "https://www.c40.org/case-studies/transforming-cities-jakarta/",
    "publication_date": "2023-02-28",
    "retrieved_at": "2026-09-21",
    "extraction_method": "llm_assisted"
  },
  "sdgs": [
    {
      "goal": 11,
      "name": "Sustainable Cities and Communities"
    },
    {
      "goal": 13,
      "name": "Climate Action"
    }
  ],
  "indicators_measured": [],
  "indicators_targeted": []
}
