{
  "schema_version": "2.0",
  "id": "c40-quezon-city-regulates-single-use-plastic-through-policy-intervention",
  "url": "https://www.c40.org/case-studies/quezon-city-regulates-single-use-plastic-through-policy-intervention/",
  "title": "Quezon City Regulates Single-Use Plastic through Policy Intervention",
  "summary": "This C40 case study describes “Quezon City Regulates Single-Use Plastic through Policy Intervention,” an urban initiative documented for Quezon City. It is included because it is located in the Global South. C40 describes the action this way: The City Government enacted the Plastic Bag Reduction Ordinance to regulate the consumers’ use of plastic bags and to implement for the…",
  "location_scope": "non_administrative",
  "locations": [
    {
      "level": "non_administrative",
      "place_name": "Quezon City",
      "adm0": {
        "name": "Philippines",
        "ucode": "PHL_V1",
        "dcid": null,
        "iso3": "PHL"
      },
      "adm1": {
        "name": "National Capital Region (Ncr)",
        "ucode": "PHL_0004_V1",
        "dcid": null
      },
      "adm2": null
    }
  ],
  "hazards": [],
  "data_sources": [],
  "provenance": {
    "collection_name": "C40 Cities case studies",
    "collection_url": "https://www.c40.org/case-studies/",
    "publisher": "C40 Cities",
    "document_url": "https://www.c40.org/case-studies/quezon-city-regulates-single-use-plastic-through-policy-intervention/",
    "publication_date": "2018-09-17",
    "retrieved_at": "2026-09-21",
    "extraction_method": "llm_assisted"
  },
  "sdgs": [
    {
      "goal": 11,
      "name": "Sustainable Cities and Communities"
    },
    {
      "goal": 12,
      "name": "Responsible Consumption and Production"
    },
    {
      "goal": 13,
      "name": "Climate Action"
    }
  ],
  "indicators_measured": [],
  "indicators_targeted": []
}
