{
  "schema_version": "2.0",
  "id": "c40-collecting-and-recycling-milk-cartons-from-schools-in-hanoi",
  "url": "https://www.c40.org/case-studies/collecting-and-recycling-milk-cartons-from-schools-in-hanoi/",
  "title": "Collecting and Recycling Milk Cartons From Schools in Hanoi",
  "summary": "This C40 case study describes “Collecting and Recycling Milk Cartons From Schools in Hanoi,” an urban initiative documented for Hanoi. It is included because it has evidence relevant to children's livelihoods, and it is located in the Global South. C40 describes the action this way: In response to the increasing amount of solid waste in Hanoi, and as a way to mitigate plastic waste, in 2019 the…",
  "location_scope": "non_administrative",
  "locations": [
    {
      "level": "non_administrative",
      "place_name": "Hanoi",
      "adm0": {
        "name": "Viet Nam",
        "ucode": "VNM_V1",
        "dcid": null,
        "iso3": "VNM"
      },
      "adm1": {
        "name": "Ha Noi City",
        "ucode": "VNM_0022_V1",
        "dcid": null
      },
      "adm2": null
    }
  ],
  "hazards": [],
  "data_sources": [],
  "provenance": {
    "collection_name": "C40 Cities case studies",
    "collection_url": "https://www.c40.org/case-studies/",
    "publisher": "C40 Cities",
    "document_url": "https://www.c40.org/case-studies/collecting-and-recycling-milk-cartons-from-schools-in-hanoi/",
    "publication_date": "2020-01-09",
    "retrieved_at": "2026-09-21",
    "extraction_method": "llm_assisted"
  },
  "sdgs": [
    {
      "goal": 4,
      "name": "Quality Education"
    },
    {
      "goal": 11,
      "name": "Sustainable Cities and Communities"
    },
    {
      "goal": 12,
      "name": "Responsible Consumption and Production"
    }
  ],
  "indicators_measured": [],
  "indicators_targeted": []
}
