{
  "schema_version": "2.0",
  "id": "c40-spotlight-on-quito",
  "url": "https://www.c40.org/case-studies/spotlight-on-quito/",
  "title": "Spotlight on… Quito",
  "summary": "This C40 case study describes “Spotlight on… Quito,” an urban initiative documented for Quito. It is included because it is located in the Global South. C40 describes the action this way: Mayor of Quito, Santiago Guarderas, on the city’s Paris Agreement-compliant climate action plan…",
  "location_scope": "non_administrative",
  "locations": [
    {
      "level": "non_administrative",
      "place_name": "Quito",
      "adm0": {
        "name": "Ecuador",
        "ucode": "ECU_V1",
        "dcid": null,
        "iso3": "ECU"
      },
      "adm1": {
        "name": "Pichincha",
        "ucode": "ECU_0019_V1",
        "dcid": null
      },
      "adm2": {
        "name": "Distrito Metropolitano De Quito",
        "ucode": "ECU_0019_0002_V1",
        "dcid": null
      }
    }
  ],
  "hazards": [],
  "data_sources": [],
  "provenance": {
    "collection_name": "C40 Cities case studies",
    "collection_url": "https://www.c40.org/case-studies/",
    "publisher": "C40 Cities",
    "document_url": "https://www.c40.org/case-studies/spotlight-on-quito/",
    "publication_date": "2022-10-20",
    "retrieved_at": "2026-09-21",
    "extraction_method": "llm_assisted"
  },
  "sdgs": [
    {
      "goal": 11,
      "name": "Sustainable Cities and Communities"
    },
    {
      "goal": 13,
      "name": "Climate Action"
    }
  ],
  "indicators_measured": [],
  "indicators_targeted": []
}
