{
  "schema_version": "2.0",
  "id": "c40-cities100-new-orleans-capturing-rainwater-curbs-flooding-events",
  "url": "https://www.c40.org/case-studies/cities100-new-orleans-capturing-rainwater-curbs-flooding-events/",
  "title": "Cities100: New Orleans – Capturing Rainwater Curbs Flooding Events",
  "summary": "This C40 case study describes “Cities100: New Orleans – Capturing Rainwater Curbs Flooding Events,” an urban initiative documented for New Orleans. It is included because it addresses river flood, extreme heat, malaria hazards. C40 describes the action this way: In New Orleans, the Gentilly Resilience District project is transforming the city’s approach of urban water management while beautifying neighborhoods….",
  "location_scope": "non_administrative",
  "locations": [
    {
      "level": "non_administrative",
      "place_name": "New Orleans",
      "adm0": {
        "name": "United States of America",
        "ucode": "USA_V1",
        "dcid": null,
        "iso3": "USA"
      },
      "adm1": {
        "name": "Louisiana",
        "ucode": "USA_0019_V1",
        "dcid": null
      },
      "adm2": null
    }
  ],
  "hazards": [
    "river_flood",
    "extreme_heat",
    "malaria"
  ],
  "data_sources": [],
  "provenance": {
    "collection_name": "C40 Cities case studies",
    "collection_url": "https://www.c40.org/case-studies/",
    "publisher": "C40 Cities",
    "document_url": "https://www.c40.org/case-studies/cities100-new-orleans-capturing-rainwater-curbs-flooding-events/",
    "publication_date": "2016-11-15",
    "retrieved_at": "2026-09-21",
    "extraction_method": "llm_assisted"
  },
  "sdgs": [
    {
      "goal": 3,
      "name": "Good Health and Well-being"
    },
    {
      "goal": 6,
      "name": "Clean Water and Sanitation"
    },
    {
      "goal": 8,
      "name": "Decent Work and Economic Growth"
    },
    {
      "goal": 10,
      "name": "Reduced Inequalities"
    },
    {
      "goal": 11,
      "name": "Sustainable Cities and Communities"
    },
    {
      "goal": 12,
      "name": "Responsible Consumption and Production"
    },
    {
      "goal": 13,
      "name": "Climate Action"
    },
    {
      "goal": 15,
      "name": "Life on Land"
    }
  ],
  "indicators_measured": [],
  "indicators_targeted": []
}
