{
  "schema_version": "2.0",
  "id": "c40-c40-bloomberg-awards-lima",
  "url": "https://www.c40.org/case-studies/c40-bloomberg-awards-lima/",
  "title": "C40-Bloomberg Philanthropies Awards: Clean air for the children of Lima",
  "summary": "This C40 case study describes “C40-Bloomberg Philanthropies Awards: Clean air for the children of Lima,” an urban initiative documented for Lima. It is included because it addresses air pollution pm25 hazards, and it has evidence relevant to children's livelihoods, and it is located in the Global South. C40 describes the action this way: The city launched ‘Aires Nuevos para la Infancia’ to improve air quality and the health of Lima’s most vulnerable residents.",
  "location_scope": "non_administrative",
  "locations": [
    {
      "level": "non_administrative",
      "place_name": "Lima",
      "adm0": {
        "name": "Peru",
        "ucode": "PER_V1",
        "dcid": null,
        "iso3": "PER"
      },
      "adm1": {
        "name": "Lima",
        "ucode": "PER_0015_V1",
        "dcid": null
      },
      "adm2": {
        "name": "Lima",
        "ucode": "PER_0015_0008_V1",
        "dcid": null
      }
    }
  ],
  "hazards": [
    "air_pollution_pm25"
  ],
  "data_sources": [
    {
      "name": "Air-quality monitoring data",
      "url": null,
      "role": "hazard_input"
    }
  ],
  "provenance": {
    "collection_name": "C40 Cities case studies",
    "collection_url": "https://www.c40.org/case-studies/",
    "publisher": "C40 Cities",
    "document_url": "https://www.c40.org/case-studies/c40-bloomberg-awards-lima/",
    "publication_date": "2022-10-19",
    "retrieved_at": "2026-09-21",
    "extraction_method": "llm_assisted"
  },
  "sdgs": [
    {
      "goal": 3,
      "name": "Good Health and Well-being"
    },
    {
      "goal": 4,
      "name": "Quality Education"
    },
    {
      "goal": 10,
      "name": "Reduced Inequalities"
    },
    {
      "goal": 11,
      "name": "Sustainable Cities and Communities"
    },
    {
      "goal": 13,
      "name": "Climate Action"
    }
  ],
  "indicators_measured": [],
  "indicators_targeted": []
}
