{
  "schema_version": "2.0",
  "id": "c40-c40-good-practice-guides-london-greening-the-bids",
  "url": "https://www.c40.org/case-studies/c40-good-practice-guides-london-greening-the-bids/",
  "title": "C40 Good Practice Guides: London – Greening the BIDs",
  "summary": "This C40 case study describes “C40 Good Practice Guides: London – Greening the BIDs,” an urban initiative documented for London. It is included because it addresses river flood, extreme heat hazards. C40 describes the action this way: Summary The Greater London Authority (GLA) is working with Business Improvement Districts (BIDs)xxviii in central London to identify and then…",
  "location_scope": "non_administrative",
  "locations": [
    {
      "level": "non_administrative",
      "place_name": "London",
      "adm0": {
        "name": "United Kingdom of Great Britain & Northern Ireland",
        "ucode": "GBR_V1",
        "dcid": null,
        "iso3": "GBR"
      },
      "adm1": {
        "name": "England",
        "ucode": "GBR_0001_V1",
        "dcid": null
      },
      "adm2": {
        "name": "Greater London",
        "ucode": "GBR_0001_0017_V1",
        "dcid": null
      }
    }
  ],
  "hazards": [
    "river_flood",
    "extreme_heat"
  ],
  "data_sources": [],
  "provenance": {
    "collection_name": "C40 Cities case studies",
    "collection_url": "https://www.c40.org/case-studies/",
    "publisher": "C40 Cities",
    "document_url": "https://www.c40.org/case-studies/c40-good-practice-guides-london-greening-the-bids/",
    "publication_date": "2016-02-15",
    "retrieved_at": "2026-09-21",
    "extraction_method": "llm_assisted"
  },
  "sdgs": [
    {
      "goal": 8,
      "name": "Decent Work and Economic Growth"
    },
    {
      "goal": 11,
      "name": "Sustainable Cities and Communities"
    },
    {
      "goal": 13,
      "name": "Climate Action"
    },
    {
      "goal": 15,
      "name": "Life on Land"
    }
  ],
  "indicators_measured": [],
  "indicators_targeted": []
}
