{
  "schema_version": "2.0",
  "id": "c40-curitiba-honey-garden",
  "url": "https://www.c40.org/case-studies/curitiba-honey-garden/",
  "title": "Honey Garden Programme in Curitiba",
  "summary": "This C40 case study describes “Honey Garden Programme in Curitiba,” an urban initiative documented for Curitiba. It is included because it is located in the Global South. C40 describes the action this way: Curitiba has set up a program to teach its citizens the importance and benefits bees have on local biodiversity and food production.",
  "location_scope": "non_administrative",
  "locations": [
    {
      "level": "non_administrative",
      "place_name": "Curitiba",
      "adm0": {
        "name": "Brazil",
        "ucode": "BRA_V1",
        "dcid": null,
        "iso3": "BRA"
      },
      "adm1": {
        "name": "Paraná",
        "ucode": "BRA_0016_V1",
        "dcid": null
      },
      "adm2": {
        "name": "Curitiba",
        "ucode": "BRA_0016_0133_V1",
        "dcid": null
      }
    }
  ],
  "hazards": [],
  "data_sources": [],
  "provenance": {
    "collection_name": "C40 Cities case studies",
    "collection_url": "https://www.c40.org/case-studies/",
    "publisher": "C40 Cities",
    "document_url": "https://www.c40.org/case-studies/curitiba-honey-garden/",
    "publication_date": "2020-01-03",
    "retrieved_at": "2026-09-21",
    "extraction_method": "llm_assisted"
  },
  "sdgs": [
    {
      "goal": 11,
      "name": "Sustainable Cities and Communities"
    },
    {
      "goal": 12,
      "name": "Responsible Consumption and Production"
    },
    {
      "goal": 13,
      "name": "Climate Action"
    },
    {
      "goal": 15,
      "name": "Life on Land"
    }
  ],
  "indicators_measured": [],
  "indicators_targeted": []
}
