{
  "schema_version": "2.0",
  "id": "c40-c40-good-practice-guides-tshwane-stakeholder-engagement-in-a-re-yeng",
  "url": "https://www.c40.org/case-studies/c40-good-practice-guides-tshwane-stakeholder-engagement-in-a-re-yeng/",
  "title": "C40 Good Practice Guides: Tshwane – Stakeholder engagement in “A Re Yeng”",
  "summary": "This C40 case study describes “C40 Good Practice Guides: Tshwane – Stakeholder engagement in “A Re Yeng”,” an urban initiative documented for Tshwane. It is included because it is located in the Global South. C40 describes the action this way: Summary Tshwane’s BRT system (A Re Yeng or “Let’s Go”), approved in 2011, forms part of the City of Tshwane’s…",
  "location_scope": "non_administrative",
  "locations": [
    {
      "level": "non_administrative",
      "place_name": "Tshwane",
      "adm0": {
        "name": "South Africa",
        "ucode": "ZAF_V1",
        "dcid": null,
        "iso3": "ZAF"
      },
      "adm1": {
        "name": "Gauteng",
        "ucode": "ZAF_0003_V1",
        "dcid": null
      },
      "adm2": {
        "name": "City of Tshwane",
        "ucode": "ZAF_0003_0002_V1",
        "dcid": null
      }
    }
  ],
  "hazards": [],
  "data_sources": [],
  "provenance": {
    "collection_name": "C40 Cities case studies",
    "collection_url": "https://www.c40.org/case-studies/",
    "publisher": "C40 Cities",
    "document_url": "https://www.c40.org/case-studies/c40-good-practice-guides-tshwane-stakeholder-engagement-in-a-re-yeng/",
    "publication_date": "2016-02-15",
    "retrieved_at": "2026-09-21",
    "extraction_method": "llm_assisted"
  },
  "sdgs": [
    {
      "goal": 10,
      "name": "Reduced Inequalities"
    },
    {
      "goal": 11,
      "name": "Sustainable Cities and Communities"
    },
    {
      "goal": 13,
      "name": "Climate Action"
    }
  ],
  "indicators_measured": [],
  "indicators_targeted": []
}
