{
  "schema_version": "2.1",
  "id": "climate-adapt-climate-proofing-social-housing-landscapes-2013-groundwork-london-and-hammersmith-fulham-council",
  "url": "https://climate-adapt.eea.europa.eu/en/metadata/case-studies/climate-proofing-social-housing-landscapes-2013-groundwork-london-and-hammersmith-fulham-council",
  "title": "Climate-Proofing Social Housing Landscapes – Groundwork London and Hammersmith & Fulham Council",
  "summary": "Groundwork London – an environmental regeneration charity part of the Groundwork federation - in partnership with Hammersmith and Fulham Council, received LIFE+ funding for the Climate-Proofing Social Housing Landscapes project in 2013. The project, which came to an end in September 2016, has demonstrated an integrated approach to climate adaptation in urban areas by undertaking a package of affordable, light-engineering climate change adaptation measures based around the retrofitting of blue and green infrastructure.",
  "location_scope": "non_administrative",
  "locations": [
    {
      "level": "non_administrative",
      "place_name": "London - Borough of Hammersmith and Fulham",
      "adm0": {
        "name": "United Kingdom of Great Britain & Northern Ireland",
        "ucode": "GBR_V1",
        "dcid": "country/GBR",
        "iso3": "GBR"
      },
      "adm1": null,
      "adm2": null
    }
  ],
  "hazards": [
    "river_flood",
    "extreme_heat"
  ],
  "source_hazard_tags": [
    {
      "vocabulary": "climate_adapt_climate_impacts",
      "code": "FLOODING",
      "label": "Flooding",
      "mapped_to": [
        "river_flood"
      ]
    },
    {
      "vocabulary": "climate_adapt_climate_impacts",
      "code": "EXTREMEHEAT",
      "label": "Extreme heat",
      "mapped_to": [
        "extreme_heat"
      ]
    }
  ],
  "point": {
    "lat": 51.5019041076,
    "lon": -0.120849609375,
    "source": "climate_adapt_geolocation"
  },
  "data_sources": [
    {
      "name": "urbanclimateproofing.london",
      "url": "http://www.urbanclimateproofing.london",
      "role": "contextual_input"
    },
    {
      "name": "ec.europa.eu",
      "url": "http://ec.europa.eu/environment/life/project/Projects/index.cfm?fuseaction=search.dspPage&n_proj_id=4752",
      "role": "contextual_input"
    }
  ],
  "provenance": {
    "collection_name": "Climate-ADAPT Case Study Explorer",
    "collection_url": "https://climate-adapt.eea.europa.eu/en/knowledge/tools/case-study-explorer",
    "publisher": "European Environment Agency",
    "document_url": "https://climate-adapt.eea.europa.eu/en/metadata/case-studies/climate-proofing-social-housing-landscapes-2013-groundwork-london-and-hammersmith-fulham-council",
    "publication_date": "2016-01-01",
    "retrieved_at": "2026-09-21",
    "extraction_method": "api",
    "source_record_id": "10f856b39d304ed49f4a867acf1f1836",
    "source_api_url": "https://climate-adapt.eea.europa.eu/++api++/en/metadata/case-studies/climate-proofing-social-housing-landscapes-2013-groundwork-london-and-hammersmith-fulham-council",
    "source_content_type": "eea.climateadapt.casestudy",
    "source_modified": "2026-08-25T08:19:52+00:00",
    "extracted_by": "scrape_climate_adapt.py@1.0"
  },
  "sdgs": [],
  "indicators_measured": [],
  "indicators_targeted": []
}
